{
  "version": "1.0.0",
  "mission": {
    "name": "",
    "one_liner": "",
    "domain": "",
    "operating_model": ""
  },
  "primary_users": {
    "icp": "",
    "personas": [],
    "jobs_to_be_done": []
  },
  "voice_and_policy": {
    "tone": "",
    "do_use": [],
    "avoid": []
  },
  "positioning": {
    "problem": "",
    "differentiation": [],
    "proof": []
  }
}
